{
  "schemaVersion": 1,
  "installationId": "arnau-preview",
  "companyName": "Arnall",
  "companySlug": "arnall",
  "publicUrl": "https://arnau.192.0.2.10.sslip.io",
  "branding": {
    "productName": "Arnall AI · Arnau",
    "logoPath": "/branding/aibrain/logo.svg",
    "faviconPath": "/branding/aibrain/favicon.svg",
    "accentColor": "#315ee7"
  },
  "paths": {
    "dataRoot": "/var/lib/aibrain/data",
    "companyContextRoot": "/var/lib/aibrain/data/company-context",
    "usersRoot": "/var/lib/aibrain/data/users",
    "sourceReadRoot": "/srv/aibrain/source-ro",
    "publishWriteRoot": "/srv/aibrain/publish-rw",
    "backupsRoot": "/var/lib/aibrain/data/backups"
  }
}
