{
  "schemaVersion": 1,
  "installationId": "northwind-qa",
  "companyName": "Northwind Advisory QA",
  "companySlug": "northwind-advisory",
  "publicUrl": "https://brain.northwind-advisory.test",
  "branding": {
    "productName": "Northwind Brain",
    "logoPath": "/branding/northwind-qa/logo.svg",
    "faviconPath": "/branding/northwind-qa/favicon.svg",
    "accentColor": "#0f766e"
  },
  "paths": {
    "dataRoot": "/srv/aibrain-northwind-qa/data",
    "companyContextRoot": "/srv/aibrain-northwind-qa/data/company-context",
    "usersRoot": "/srv/aibrain-northwind-qa/data/employees",
    "sourceReadRoot": "/mnt/aibrain-northwind-qa/source-ro",
    "publishWriteRoot": "/mnt/aibrain-northwind-qa/publish-rw",
    "backupsRoot": "/srv/aibrain-northwind-qa/data/backup-snapshots"
  }
}
